{
	"$schema" : "http://json-schema.org/draft-04/schema#",
	"title" : "meerkat_categorize output",
	"description": "A schema for defining output from 'meerkat_categorize'",
	"type" : "object",
	"properties" : {
		"cobrand_id" : {
			"description" : "Yodlee's number to uniquely identify the cobrand",
			"type" : "number"
		},
		"user_id" : {
			"description" : "Yodlee's number to uniquely identify a user within a cobrand",
			"type" : "number"
		},
		"container" : { "enum" : [ "bank", "card" ] },
		"transaction_list" : {
			"description" : "An array containing at least one of the following response types.",
			"type" : "array",
			"minItems": 1,
			"uniqueItems": true
		}
	},
	"required": ["cobrand_id", "user_id", "container", "transaction_list"]
}
